{
  "schema_version": 1,
  "topology_generation": 7,
  "created_at_monotonic": 1100,
  "candidates": [
    {
      "candidate_id": "candidate-v1:cccccccccccccccccccccccccccccccccccccccccccccccccccccccccccccccc",
      "kind": "MAPPED_V4",
      "transport": "TCP",
      "local_endpoint": {
        "address_family": "IPV4",
        "address_class": "RFC1918",
        "identity_digest": "endpoint-v1:aaaaaaaaaaaaaaaaaaaaaaaaaaaaaaaaaaaaaaaaaaaaaaaaaaaaaaaaaaaaaaaa"
      },
      "published_endpoint": {
        "address_family": "IPV4",
        "address_class": "PUBLIC",
        "identity_digest": "endpoint-v1:bbbbbbbbbbbbbbbbbbbbbbbbbbbbbbbbbbbbbbbbbbbbbbbbbbbbbbbbbbbbbbbb"
      },
      "network_kind": "NATIVE",
      "interface_identity_digest": "interface-v1:dddddddddddddddddddddddddddddddddddddddddddddddddddddddddddddddd",
      "source": "PCP",
      "scope": "GLOBAL",
      "mapping_identity": "mapping-v1:eeeeeeeeeeeeeeeeeeeeeeeeeeeeeeeeeeeeeeeeeeeeeeeeeeeeeeeeeeeeeeee",
      "lease_expires_at": {
        "basis": "SNAPSHOT_RELATIVE",
        "remaining_ms": 59900
      },
      "ownership_state": "OWNED_BY_US",
      "verification_state": "VERIFIED",
      "verification_attempt_id": "attempt-v1:ffffffffffffffffffffffffffffffffffffffffffffffffffffffffffffffff",
      "evidence_digest": "evidence-v1:1111111111111111111111111111111111111111111111111111111111111111",
      "reason_code": "NONE",
      "topology_generation": 7
    }
  ],
  "terminal_reason": "NONE"
}
