{"schema_version":1,"topology_generation":8,"created_at_monotonic":1500,"candidates":[{"candidate_id":"candidate-v1:1616161616161616161616161616161616161616161616161616161616161616","kind":"MAPPED_V4","transport":"TCP","local_endpoint":{"address_family":"IPV4","address_class":"RFC1918","identity_digest":"endpoint-v1:1717171717171717171717171717171717171717171717171717171717171717"},"published_endpoint":{"address_family":"IPV4","address_class":"PUBLIC","identity_digest":"endpoint-v1:1818181818181818181818181818181818181818181818181818181818181818"},"network_kind":"NATIVE","interface_identity_digest":"interface-v1:1919191919191919191919191919191919191919191919191919191919191919","source":"PCP","scope":"GLOBAL","mapping_identity":"mapping-v1:2020202020202020202020202020202020202020202020202020202020202020","lease_expires_at":{"basis":"SNAPSHOT_RELATIVE","remaining_ms":1000},"ownership_state":"OWNED_BY_US","verification_state":"STALE","verification_attempt_id":null,"evidence_digest":null,"reason_code":"STALE_GENERATION","topology_generation":7}],"terminal_reason":"NONE"}
