{"schema_version":1,"topology_generation":7,"created_at_monotonic":1400,"candidates":[{"candidate_id":"candidate-v1:1212121212121212121212121212121212121212121212121212121212121212","kind":"LAN","transport":"TCP","local_endpoint":{"address_family":"IPV6","address_class":"UNIQUE_LOCAL","identity_digest":"endpoint-v1:1313131313131313131313131313131313131313131313131313131313131313"},"published_endpoint":{"address_family":"IPV6","address_class":"UNIQUE_LOCAL","identity_digest":"endpoint-v1:1414141414141414141414141414141414141414141414141414141414141414"},"network_kind":"NATIVE","interface_identity_digest":"interface-v1:1515151515151515151515151515151515151515151515151515151515151515","source":"OS","scope":"SAME_LAN","mapping_identity":null,"lease_expires_at":null,"ownership_state":"NOT_APPLICABLE","verification_state":"CANDIDATE","verification_attempt_id":null,"evidence_digest":null,"reason_code":"NONE","topology_generation":7}],"terminal_reason":"NONE"}
