{"schema_version":1,"topology_generation":7,"created_at_monotonic":1300,"candidates":[{"candidate_id":"candidate-v1:8888888888888888888888888888888888888888888888888888888888888888","kind":"MAPPED_V4","transport":"UDP","local_endpoint":{"address_family":"IPV4","address_class":"RFC1918","identity_digest":"endpoint-v1:9999999999999999999999999999999999999999999999999999999999999999"},"published_endpoint":{"address_family":"IPV4","address_class":"PUBLIC","identity_digest":"endpoint-v1:aaaaaaaaaaaaaaaaaaaaaaaaaaaaaaaaaaaaaaaaaaaaaaaaaaaaaaaaaaaaaaaa"},"network_kind":"NATIVE","interface_identity_digest":"interface-v1:bbbbbbbbbbbbbbbbbbbbbbbbbbbbbbbbbbbbbbbbbbbbbbbbbbbbbbbbbbbbbbbb","source":"PCP","scope":"GLOBAL","mapping_identity":"mapping-v1:cccccccccccccccccccccccccccccccccccccccccccccccccccccccccccccccc","lease_expires_at":{"basis":"SNAPSHOT_RELATIVE","remaining_ms":7200000},"ownership_state":"OWNED_BY_US","verification_state":"VERIFIED","verification_attempt_id":"attempt-v1:dddddddddddddddddddddddddddddddddddddddddddddddddddddddddddddddd","evidence_digest":"evidence-v1:eeeeeeeeeeeeeeeeeeeeeeeeeeeeeeeeeeeeeeeeeeeeeeeeeeeeeeeeeeeeeeee","reason_code":"NONE","topology_generation":7}],"terminal_reason":"NONE"}
