{"schema_version":1,"topology_generation":7,"created_at_monotonic":1200,"candidates":[{"candidate_id":"candidate-v1:2222222222222222222222222222222222222222222222222222222222222222","kind":"HOST_V6","transport":"TCP","local_endpoint":{"address_family":"IPV6","address_class":"GLOBAL","identity_digest":"endpoint-v1:3333333333333333333333333333333333333333333333333333333333333333"},"published_endpoint":{"address_family":"IPV6","address_class":"GLOBAL","identity_digest":"endpoint-v1:4444444444444444444444444444444444444444444444444444444444444444"},"network_kind":"NATIVE","interface_identity_digest":"interface-v1:5555555555555555555555555555555555555555555555555555555555555555","source":"OS","scope":"GLOBAL","mapping_identity":null,"lease_expires_at":null,"ownership_state":"NOT_APPLICABLE","verification_state":"VERIFIED","verification_attempt_id":"attempt-v1:6666666666666666666666666666666666666666666666666666666666666666","evidence_digest":"evidence-v1:7777777777777777777777777777777777777777777777777777777777777777","reason_code":"NONE","topology_generation":7}],"terminal_reason":"NONE"}
